{
  "manifestSchemaVersion": 1,
  "specVersion": "2026.09-draft",
  "testId": "SOL-TCK-0344",
  "category": "objects",
  "profile": "full-language",
  "status": "required",
  "requirements": [
    "REQ-2302"
  ],
  "entryPoint": "main.sol",
  "outcome": "COMPILE_ERROR",
  "expectation": {
    "diagnostic": {}
  }
}
