{
  "manifestSchemaVersion": 1,
  "specVersion": "2026.09-draft",
  "testId": "SOL-TCK-0120",
  "category": "control",
  "profile": "full-language",
  "status": "required",
  "requirements": [
    "REQ-1200"
  ],
  "entryPoint": "main.sol",
  "outcome": "SUCCESS",
  "expectation": {
    "languageExit": 0,
    "stdoutBase64": "MjU="
  }
}
