{
  "manifestSchemaVersion": 1,
  "specVersion": "2026.09-draft",
  "testId": "SOL-TCK-0370",
  "category": "files",
  "profile": "full-language",
  "status": "required",
  "requirements": [
    "REQ-2600"
  ],
  "entryPoint": "main.sol",
  "outcome": "COMPILE_ERROR",
  "expectation": {
    "diagnostic": {
      "family": "RESOL",
      "code": "SOLV-RESOL-007"
    }
  }
}
