{
  "manifestSchemaVersion": 1,
  "specVersion": "2026.09-draft",
  "testId": "SOL-TCK-0104",
  "category": "modules",
  "profile": "full-language",
  "status": "required",
  "requirements": [
    "REQ-1011"
  ],
  "entryPoint": "main.sol",
  "fixtureRoot": ".",
  "outcome": "COMPILE_ERROR",
  "expectation": {
    "diagnostic": {
      "family": "RESOL"
    }
  }
}
