{
  "manifestSchemaVersion": 1,
  "specVersion": "2026.09-draft",
  "testId": "SOL-TCK-0200",
  "category": "match",
  "profile": "full-language",
  "status": "required",
  "requirements": [
    "REQ-1507"
  ],
  "entryPoint": "main.sol",
  "outcome": "SUCCESS",
  "expectation": {
    "languageExit": 0,
    "stdoutBase64": "Ym90aDI="
  }
}
