{
 "manifestSchemaVersion": 1,
 "specVersion": "2026.09-draft",
 "testId": "SOL-TCK-0062",
 "category": "objects",
 "profile": "full-language",
 "status": "required",
 "requirements": [
  "REQ-0604"
 ],
 "entryPoint": "main.sol",
 "outcome": "SUCCESS",
 "expectation": {
  "languageExit": 0,
  "stdoutBase64": "c2hhZG93PTMvOTk="
 }
}
