{
  "manifestSchemaVersion": 1,
  "specVersion": "2026.09-draft",
  "testId": "SOL-TCK-0362",
  "category": "types",
  "profile": "full-language",
  "status": "required",
  "requirements": [
    "REQ-2500"
  ],
  "entryPoint": "main.sol",
  "outcome": "SUCCESS",
  "expectation": {
    "languageExit": 0,
    "stdoutBase64": "NDJ8NDJ8MS41fDEuNXxBfGhpfHRydWU="
  }
}
