{
  "manifestSchemaVersion": 1,
  "specVersion": "2026.09-draft",
  "testId": "SOL-TCK-0138",
  "category": "control",
  "profile": "full-language",
  "status": "required",
  "requirements": [
    "REQ-1213"
  ],
  "entryPoint": "main.sol",
  "outcome": "COMPILE_ERROR",
  "expectation": {
    "diagnostic": {
      "family": "TYPE",
      "code": "SOLV-TYPE-012"
    }
  }
}
