{
  "manifestSchemaVersion": 1,
  "specVersion": "2026.09-draft",
  "testId": "SOL-TCK-0156",
  "category": "exceptions",
  "profile": "full-language",
  "status": "required",
  "requirements": [
    "REQ-1308"
  ],
  "entryPoint": "main.sol",
  "outcome": "SUCCESS",
  "expectation": {
    "languageExit": 0,
    "stdoutBase64": "c3BlY2lmaWM="
  }
}
