{
  "manifestSchemaVersion": 1,
  "specVersion": "2026.09-draft",
  "testId": "SOL-TCK-0303",
  "category": "syntax",
  "profile": "full-language",
  "status": "required",
  "requirements": [
    "REQ-1905"
  ],
  "entryPoint": "main.sol",
  "outcome": "SUCCESS",
  "expectation": {
    "languageExit": 0,
    "stdoutBase64": "aW5kb25l"
  }
}
