{
  "manifestSchemaVersion": 1,
  "specVersion": "2026.09-draft",
  "testId": "SOL-TCK-0022",
  "category": "lexical",
  "profile": "full-language",
  "status": "required",
  "requirements": [
    "REQ-0403"
  ],
  "entryPoint": "main.sol",
  "outcome": "SUCCESS",
  "expectation": {
    "languageExit": 0,
    "stdoutBase64": "MS0y"
  }
}
