{
  "manifestSchemaVersion": 1,
  "specVersion": "2026.09-draft",
  "testId": "SOL-TCK-0108",
  "category": "regex",
  "profile": "full-language",
  "status": "required",
  "requirements": [
    "REQ-1103"
  ],
  "entryPoint": "main.sol",
  "outcome": "SUCCESS",
  "expectation": {
    "languageExit": 0,
    "stdoutBase64": "MyAxOjE6MiAyMjozOjUgMzMzOjY6OSAyIDE="
  }
}
