{
  "manifestSchemaVersion": 1,
  "specVersion": "2026.09-draft",
  "testId": "SOL-TCK-0230",
  "category": "evaluation",
  "profile": "full-language",
  "status": "required",
  "requirements": [
    "REQ-1605"
  ],
  "entryPoint": "main.sol",
  "outcome": "SUCCESS",
  "expectation": {
    "languageExit": 0,
    "stdoutBase64": "UFF0cnVlUVBmYWxzZQ=="
  }
}
