{
  "manifestSchemaVersion": 1,
  "specVersion": "2026.09-draft",
  "testId": "SOL-TCK-0316",
  "category": "result",
  "profile": "full-language",
  "status": "required",
  "requirements": [
    "REQ-2003"
  ],
  "entryPoint": "main.sol",
  "outcome": "COMPILE_ERROR",
  "expectation": {
    "diagnostic": {
      "family": "SEM",
      "code": "SOLV-SEM-050"
    }
  }
}
