{
  "manifestSchemaVersion": 1,
  "specVersion": "2026.09-draft",
  "testId": "SOL-TCK-0088",
  "category": "collections",
  "profile": "full-language",
  "status": "required",
  "requirements": [
    "REQ-0902"
  ],
  "entryPoint": "main.sol",
  "outcome": "SUCCESS",
  "expectation": {
    "languageExit": 0,
    "stdoutBase64": "MiA5IDI="
  }
}
