{
  "manifestSchemaVersion": 1,
  "specVersion": "2026.09-draft",
  "testId": "SOL-TCK-0414",
  "category": "modules",
  "profile": "full-language",
  "status": "required",
  "requirements": [
    "REQ-3107"
  ],
  "entryPoint": "main.sol",
  "fixtureRoot": ".",
  "outcome": "SUCCESS",
  "expectation": {
    "languageExit": 0,
    "stdoutBase64": "bm03"
  }
}
